{
  "schemaVersion": 1,
  "datasetVersion": "che-tao-2026-09-12-v0.3",
  "dataKind": "synthetic",
  "reviewStatus": "draft",
  "crs": "EPSG:32648",
  "incident": {
    "id": "INC-2026-0412",
    "title": [
      "Sạt lở, nguy cơ lũ quét",
      "Landslide and flash-flood risk"
    ],
    "mode": "prepared",
    "schemaVersion": "0.1",
    "triggeredAt": "2026-09-12T03:40:00+07:00",
    "asOf": "2026-09-12T14:02:00+07:00",
    "asOfUpdated": "2026-09-12T14:16:00+07:00",
    "timeline": [
      [
        "03:40",
        "Kích hoạt sự kiện",
        "Incident triggered",
        "Mưa cực đoan trên tuyến Mù Cang Chải – Chế Tạo",
        "Extreme rainfall on the Mù Cang Chải – Chế Tạo road"
      ],
      [
        "04:05",
        "Yêu cầu ảnh sau sự kiện",
        "Post-event imagery requested",
        "Ưu tiên ảnh quang học PlanetScope và dữ liệu địa hình DEM",
        "Prioritised PlanetScope optical imagery and DEM terrain data"
      ],
      [
        "10:43",
        "Có ảnh sau sự kiện",
        "Post-event imagery available",
        "PlanetScope 3 m thu nhận lúc 10:43",
        "PlanetScope 3 m acquired at 10:43"
      ],
      [
        "11:36",
        "Đánh dấu điểm ảnh hưởng",
        "Affected sites mapped",
        "Khoanh 3 vết sạt trên đường chính",
        "Three scars on the main road outlined"
      ],
      [
        "12:41",
        "Đánh giá mức ưu tiên",
        "Priority assessment",
        "Kết hợp tác động thực địa và khả năng tiếp cận từng thôn bản",
        "Combined hazard impact with commune accessibility"
      ],
      [
        "14:02",
        "Có phương án tiếp cận",
        "Access options available",
        "Ba vết sạt trên tuyến duy nhất Mù Cang Chải – Chế Tạo",
        "Three scars on the only Mù Cang Chải – Chế Tạo road"
      ]
    ],
    "sources": [
      {
        "id": "network",
        "name": [
          "Mạng đường",
          "Road network"
        ],
        "observedAt": "2026-09-12T03:40:00+07:00",
        "note": [
          "OpenStreetMap (ODbL, truy xuất 20/10/2026)",
          "OpenStreetMap (ODbL, retrieved 20 Oct 2026)"
        ]
      },
      {
        "id": "radar",
        "name": [
          "Ảnh PlanetScope sau sự kiện",
          "Post-event PlanetScope imagery"
        ],
        "observedAt": "2026-09-12T10:43:00+07:00",
        "note": [
          "PlanetScope 3 m, thu nhận 10:43",
          "PlanetScope 3 m, acquired 10:43"
        ]
      },
      {
        "id": "hazard",
        "name": [
          "Phân tích sạt lở",
          "Landslide analysis"
        ],
        "observedAt": "2026-09-12T11:36:00+07:00",
        "note": [
          "Giải đoán ảnh PlanetScope, đối chiếu ảnh trước mùa mưa",
          "PlanetScope interpretation against pre-monsoon imagery"
        ]
      },
      {
        "id": "field",
        "name": [
          "Tin từ xã",
          "Commune focal point"
        ],
        "observedAt": "2026-09-12T04:10:00+07:00",
        "observedAtUpdated": "2026-09-12T14:11:00+07:00",
        "note": [
          "Mất liên lạc với Chế Tạo; tổ kiểm tra tuyến báo cáo lúc 14:11",
          "Contact with Chế Tạo lost; road check team reported at 14:11"
        ]
      },
      {
        "id": "route",
        "name": [
          "Phương án tiếp cận",
          "Access options"
        ],
        "observedAt": "2026-09-12T14:02:00+07:00",
        "note": [
          "Tổng hợp phương án tiếp cận",
          "Access-route calculation"
        ],
        "observedAtUpdated": "2026-09-12T14:16:00+07:00"
      }
    ]
  },
  "communities": [
    {
      "id": "CT",
      "name": "Chế Tạo",
      "commune": "Chế Tạo",
      "pop": 640,
      "hh": 142,
      "desc": [
        "Mất liên lạc từ 04:10. Chưa rõ nhu cầu hỗ trợ",
        "No contact since 04:10. Relief needs unconfirmed"
      ],
      "facts": [
        {
          "kind": "report",
          "label": [
            "Đường Mù Cang Chải – Chế Tạo",
            "Mù Cang Chải – Chế Tạo road"
          ],
          "value": [
            "Ba vết sạt cắt qua đường trên ảnh vệ tinh.",
            "Three landslide scars cross the road on satellite imagery."
          ],
          "hazardId": "LS-02"
        },
        {
          "kind": "report",
          "label": [
            "Liên lạc",
            "Communications"
          ],
          "value": [
            "Mất liên lạc với bản.",
            "Contact with the village lost."
          ],
          "source": [
            "Tin từ xã",
            "Commune focal point"
          ],
          "observedAt": "2026-09-12T04:10:00+07:00",
          "receivedAt": "2026-09-12T13:45:00+07:00"
        },
        {
          "kind": "gap",
          "label": [
            "Nhu cầu hỗ trợ",
            "Assistance needs"
          ],
          "value": [
            "Chưa xác định nhu cầu y tế và cứu trợ.",
            "Medical and relief needs are unconfirmed."
          ]
        }
      ],
      "projected": {
        "x": 400027.0,
        "y": 2402754.4
      }
    }
  ],
  "roads": [
    {
      "id": "E0",
      "name": [
        "Đường Mù Cang Chải – Chế Tạo, đoạn 1",
        "Mù Cang Chải – Chế Tạo road, section 1"
      ],
      "cls": "primary",
      "status": "open",
      "points": [
        {
          "x": 405915.9,
          "y": 2416469.4
        },
        {
          "x": 405868.1,
          "y": 2416414.6
        },
        {
          "x": 405836.3,
          "y": 2416387.7
        },
        {
          "x": 405828.9,
          "y": 2416353.4
        },
        {
          "x": 405822.4,
          "y": 2416344.5
        },
        {
          "x": 405807.1,
          "y": 2416332.8
        },
        {
          "x": 405783.9,
          "y": 2416327.2
        },
        {
          "x": 405762.2,
          "y": 2416326.5
        },
        {
          "x": 405748.2,
          "y": 2416329.8
        },
        {
          "x": 405736.6,
          "y": 2416338.7
        },
        {
          "x": 405711.3,
          "y": 2416377.1
        },
        {
          "x": 405700.8,
          "y": 2416381.5
        },
        {
          "x": 405688.0,
          "y": 2416383.0
        },
        {
          "x": 405651.1,
          "y": 2416375.6
        },
        {
          "x": 405623.1,
          "y": 2416381.6
        },
        {
          "x": 405611.2,
          "y": 2416379.6
        },
        {
          "x": 405561.6,
          "y": 2416331.8
        },
        {
          "x": 405551.8,
          "y": 2416330.2
        },
        {
          "x": 405543.2,
          "y": 2416332.4
        },
        {
          "x": 405536.2,
          "y": 2416340.8
        },
        {
          "x": 405534.6,
          "y": 2416357.4
        },
        {
          "x": 405543.1,
          "y": 2416380.0
        },
        {
          "x": 405537.8,
          "y": 2416395.1
        },
        {
          "x": 405531.9,
          "y": 2416398.8
        },
        {
          "x": 405521.8,
          "y": 2416401.1
        },
        {
          "x": 405501.5,
          "y": 2416394.7
        },
        {
          "x": 405479.5,
          "y": 2416371.9
        },
        {
          "x": 405474.9,
          "y": 2416359.3
        },
        {
          "x": 405475.8,
          "y": 2416346.3
        },
        {
          "x": 405484.4,
          "y": 2416326.0
        },
        {
          "x": 405489.9,
          "y": 2416301.7
        },
        {
          "x": 405498.4,
          "y": 2416290.1
        },
        {
          "x": 405524.1,
          "y": 2416271.6
        },
        {
          "x": 405569.3,
          "y": 2416268.1
        },
        {
          "x": 405578.9,
          "y": 2416264.8
        },
        {
          "x": 405591.4,
          "y": 2416250.2
        },
        {
          "x": 405612.5,
          "y": 2416191.5
        },
        {
          "x": 405613.1,
          "y": 2416182.2
        },
        {
          "x": 405600.6,
          "y": 2416142.3
        },
        {
          "x": 405600.9,
          "y": 2416131.9
        },
        {
          "x": 405604.7,
          "y": 2416126.5
        },
        {
          "x": 405629.4,
          "y": 2416114.4
        },
        {
          "x": 405643.0,
          "y": 2416103.8
        },
        {
          "x": 405655.3,
          "y": 2416068.5
        },
        {
          "x": 405659.2,
          "y": 2416043.7
        },
        {
          "x": 405654.0,
          "y": 2416032.0
        },
        {
          "x": 405642.5,
          "y": 2416035.0
        },
        {
          "x": 405619.4,
          "y": 2416089.1
        },
        {
          "x": 405611.4,
          "y": 2416094.5
        },
        {
          "x": 405598.6,
          "y": 2416097.3
        },
        {
          "x": 405548.2,
          "y": 2416088.1
        },
        {
          "x": 405539.7,
          "y": 2416096.5
        },
        {
          "x": 405537.8,
          "y": 2416114.5
        },
        {
          "x": 405540.6,
          "y": 2416138.6
        },
        {
          "x": 405535.9,
          "y": 2416143.9
        },
        {
          "x": 405496.6,
          "y": 2416164.1
        },
        {
          "x": 405459.0,
          "y": 2416177.8
        },
        {
          "x": 405432.2,
          "y": 2416182.9
        },
        {
          "x": 405407.2,
          "y": 2416179.3
        },
        {
          "x": 405376.5,
          "y": 2416148.3
        },
        {
          "x": 405345.9,
          "y": 2416137.7
        },
        {
          "x": 405297.5,
          "y": 2416095.2
        },
        {
          "x": 405203.4,
          "y": 2416069.4
        },
        {
          "x": 405187.9,
          "y": 2416052.0
        },
        {
          "x": 405182.0,
          "y": 2416050.1
        },
        {
          "x": 405158.3,
          "y": 2416061.7
        },
        {
          "x": 405145.4,